helperUserID,requestedUserID,order_title,order_note,lat,long,isTaken,isFinished
,FionaZhang888,Buy Food from 99 Ranch,Thank you so much!!,34.052235,-118.243683,FALSE,FALSE
,JulieShi666,Essential Needs Costco,I really appreciate that!,34.028294,-118.27521,FALSE,FALSE
,Wangyuan233,Urgent need for medicine,Together we can beat it!,34.01697,-118.288765,FALSE,FALSE
,Tigoooo,Food from Trader Joes,I cannot say more in words but thx,34.017357,-118.278404,FALSE,FALSE
,Miiiki,Support a single mom and her fam,Thanks for your generosity,34.02876,-118.27517,FALSE,FALSE
,Marker,Ralphs grocery,Together we can beat it!,34.02523,-118.29857,FALSE,FALSE